{
  "$schema": "http://json-schema.org/draft-07/schema#",
  "title": "Mockup artifact",
  "description": "A reviewable screen a flow step renders. The `screen` field is the bare id that flow steps/branches reference via `step.screen`; the artifact `id` is the path-stable `<product>/<name>`. frontend-coder builds each screen to match the Mockup, populated from the same Mock Data. `renders` points at a self-contained HTML rendering (the flow-site / Atlas is the runtime renderer); it may be null for a screen that is registered but not yet drawn.",
  "type": "object",
  "additionalProperties": false,
  "required": ["id", "component", "screen", "title", "summary", "entities", "source", "renders", "status", "readiness", "version", "provenance"],
  "properties": {
    "id": { "type": "string", "pattern": "^[a-z0-9-]+/[a-z0-9-]+$", "description": "<product>/<name>, path-stable (e.g. fern-and-fig/plant-listing)." },
    "component": { "type": "string", "description": "Owning component (matches a key in docs/acceptance-criteria/index.yaml, e.g. ux-prototyping)." },
    "screen": { "type": "string", "pattern": "^[a-z0-9-]+$", "description": "The bare screen id that flow steps/branches reference via step.screen (e.g. 'plant-listing'). Resolved by the product-truth validator against every flow's step/branch screen." },
    "title": { "type": "string", "minLength": 1, "description": "HUMAN: short screen title." },
    "summary": { "type": "string", "minLength": 1, "description": "HUMAN: one-paragraph plain-language description of what the screen shows." },
    "entities": { "type": "array", "items": { "type": "string", "pattern": "^[A-Z][A-Za-z0-9]+$" }, "description": "Entities the screen renders. Every value must be a member of index.json entity_registry." },
    "source": { "type": "string", "enum": ["mock", "real"], "description": "Whether the screen renders mock/demo data or a real system surface." },
    "example_product": { "type": "string", "pattern": "^[a-z0-9-]+$", "description": "ADR-044: self-declared example-product marker. Set ONLY on an example screen (today: fern-and-fig), to the product-root slug it belongs to -- never a display name, never the project's own product root. Absent on every screen of the project's own record. OPTIONAL and never required; never used to decide ownership." },
    "realization": { "type": "string", "enum": ["built", "spec", "mock"], "description": "Does the screen EXIST in the repo today? built = drawn and wired; spec = aspirational, not-yet-drawn; mock = sample/demo screen. OPTIONAL — absent defaults to 'built'. Parallels flow.realization." },
    "renders": { "type": ["string", "null"], "description": "Path to the self-contained HTML rendering, relative to this mockup file's directory (e.g. 'plant-listing.html'). Null when the screen is registered but not yet drawn." },
    "status": { "type": "string", "enum": ["active", "deprecated"], "description": "Lifecycle: is this screen live or retired." },
    "superseded_by": { "type": ["string", "null"], "description": "id of the artifact replacing this one when status=deprecated." },
    "readiness": { "type": "string", "enum": ["draft", "reviewed", "approved"], "description": "Review state: has a persona approved it yet." },
    "version": { "type": "integer", "minimum": 1 },
    "shape_version": {"type": "integer", "minimum": 1, "description": "Which iteration of the record's shape conventions this screen declares it is written to. Optional: one that omits it predates every size bound and is only warned about, never blocked; a bound blocks every screen only once none is left on an older version (product_truth_bounds, UXP-700e-1-ii)."},
    "tags": { "type": "array", "items": { "type": "string" } },
    "mock_data_ref": { "type": "string", "pattern": "^[a-z0-9-]+/[a-z0-9-]+$", "description": "id of the Mock Data artifact whose records populate this screen." },
    "provenance": {
      "type": "array",
      "items": {
        "type": "object",
        "additionalProperties": false,
        "properties": {
          "action": { "type": "string", "enum": ["authored", "reviewed", "approved", "extended", "deprecated", "superseded"] },
          "by": { "type": "string" },
          "date": { "type": "string" },
          "note": { "type": "string" }
        }
      }
    }
  }
}
