{
  "id": "fern-and-fig/checkout",
  "component": "ux-prototyping",
  "example_product": "fern-and-fig",
  "screen": "checkout",
  "title": "Checkout",
  "summary": "The checkout screen: confirms the signed-in customer's details and takes payment for the cart, creating an Order. Populated by hand from Customer alex-green + the pending Order 1050 (ZZ Plant, EUR 28). Also renders the two honest failure states this screen owns — payment declined (branch paymentFailed) and sold-out-at-checkout (branch outOfStockAtCheckout).",
  "entities": ["Customer", "Order"],
  "source": "mock",
  "renders": "checkout.html",
  "status": "active",
  "superseded_by": null,
  "readiness": "reviewed",
  "version": 2,
  "tags": ["checkout"],
  "mock_data_ref": "fern-and-fig/catalog",
  "provenance": [
    { "action": "authored", "by": "BrainCandy (product-truth linking session)", "date": "2026-07-14", "note": "Stub registration for flow screen resolution; HTML to be authored by the mockup agent, matching plant-listing quality." },
    { "action": "extended", "by": "BrainCandy (product-truth hardening pass)", "date": "2026-07-14", "note": "Drawn: checkout.html authored by hand from Customer alex-green + Order 1050, including the payment-declined and sold-out-at-checkout failure states, matching the plant-listing gold-reference style; readiness draft → reviewed." }
  ]
}
